{
  "version": "1.0.0",
  "mode": "advanced",
  "generated_at": "2026-01-24T19:46:08.577728+00:00",
  "source": {
    "file": "docs/refs/hexmap.json",
    "exportDate": "2026-01-24T12:10:39.974Z"
  },
  "factions": [
    {
      "id": "blackhand",
      "name": "The Black Hand",
      "race": "Special",
      "race_id": "special",
      "coat_of_arms": null,
      "color": null,
      "capital_name": "Tower of Zards",
      "capital_id": "tower_of_zards",
      "cities": [
        {
          "id": "tower_of_zards",
          "name": "Tower of Zards",
          "coords": {
            "col": 30,
            "row": 3
          },
          "armies": null,
          "sea_fleet": null,
          "is_capital": true,
          "intrinsic_defense": 6,
          "terrain": {
            "castle": true,
            "royal": true
          }
        }
      ],
      "notes": "Inferred from hexmap and starting units; advanced-only faction."
    },
    {
      "id": "eaters",
      "name": "The Eaters of Wisdom",
      "race": "Special",
      "race_id": "special",
      "coat_of_arms": null,
      "color": null,
      "capital_name": "Invisible School",
      "capital_id": "invisible_school",
      "cities": [
        {
          "id": "invisible_school",
          "name": "Invisible School",
          "coords": {
            "col": 12,
            "row": 10
          },
          "armies": null,
          "sea_fleet": null,
          "is_capital": true,
          "intrinsic_defense": 5,
          "terrain": {
            "castle": true,
            "royal": true
          }
        }
      ],
      "notes": "Inferred from hexmap and starting units; advanced-only faction."
    }
  ]
}
